{
  "format_version": 1,
  "baseline_predecessor": "100",
  "migration_plan": {
    "expand_candidate": "101",
    "backfill_checkpoint_candidate": "102",
    "contract_candidate": "103",
    "allocation_rule": "Re-read the immutable active catalog and all active changes immediately before creating each migration; reallocate forward on any conflict and never edit an applied migration."
  },
  "entries": [
    {
      "id": "rbac_role_application_knowledge_base",
      "object_type": "table",
      "table": "rbac_role_application_knowledge_base",
      "owner": "authorization_center",
      "semantics": "现有角色应用业务访问记录的明确知识库允许集合；不支持显式拒绝或跨应用继承",
      "classification": "canonical_mutable_fact",
      "canonical_source": "角色业务访问分区的明确授权操作",
      "writers": ["code:backend/app/modules/authorization_center/infrastructure/repository.py"],
      "readers": ["code:backend/app/modules/authorization_center/infrastructure/repository.py"],
      "lifecycle": "随业务分区 revision 原子替换，当前全部展开明确 ID，移除应用记录级联撤销",
      "retention_policy": "当前事实保留至撤销；授权变更摘要保留于既有审计",
      "audit_requirement": "记录角色、应用、KB 标识和业务修订；不记录知识正文或凭据",
      "retirement": {"status": "retained", "earliest_phase": "never", "gates": ["替代授权事实源必须明确迁移"]},
      "evidence_refs": ["migration:137_expand_knowledge_retrieval_governance"]
    },
    {
      "id": "knowledge.source_binding",
      "object_type": "table",
      "table": "knowledge.source_binding",
      "owner": "knowledge",
      "semantics": "离线来源绑定修订；不改变来源存储身份或授予业务权限",
      "classification": "operational_coordination_fact",
      "canonical_source": "导入侧显式确认的受信实例、Team 和批次摘要；历史技术核验单独留存",
      "writers": [
        "code:backend/app/modules/knowledge/infrastructure/governance_repository.py"
      ],
      "readers": [
        "code:backend/app/modules/knowledge/infrastructure/governance_repository.py"
      ],
      "lifecycle": "保留历史来源确认与核验证据；新知识资源不依赖此绑定，撤销不控制新资源读取",
      "retention_policy": "不自动删除；清理须显式授权并核对发布和审计依赖",
      "audit_requirement": "只记录标识、版本、计数和安全摘要；不保存凭据、正文或原始响应",
      "retirement": {
        "status": "retained",
        "earliest_phase": "never",
        "gates": [
          "替代治理及历史引用留存须先明确确认"
        ]
      },
      "evidence_refs": [
        "migration:137_expand_knowledge_retrieval_governance",
        "migration:138_expand_knowledge_source_confirmation"
      ]
    },
    {
      "id": "knowledge.retrieval_resource",
      "object_type": "table",
      "table": "knowledge.retrieval_resource",
      "owner": "knowledge",
      "semantics": "知识检索逻辑资源；草稿和发布指针不授予用户读取权",
      "classification": "canonical_mutable_fact",
      "canonical_source": "显式知识资源管理操作及固定来源和索引版本",
      "writers": [
        "code:backend/app/modules/knowledge/infrastructure/governance_repository.py"
      ],
      "readers": [
        "code:backend/app/modules/knowledge/infrastructure/governance_repository.py"
      ],
      "lifecycle": "新增默认未核验或未发布；替换保留历史；撤销禁止运行读取",
      "retention_policy": "不自动删除；清理须显式授权并核对发布和审计依赖",
      "audit_requirement": "只记录标识、版本、计数和安全摘要；不保存凭据、正文或原始响应",
      "retirement": {
        "status": "retained",
        "earliest_phase": "never",
        "gates": [
          "替代治理及历史引用留存须先明确确认"
        ]
      },
      "evidence_refs": [
        "migration:137_expand_knowledge_retrieval_governance"
      ]
    },
    {
      "id": "knowledge.retrieval_revision",
      "object_type": "table",
      "table": "knowledge.retrieval_revision",
      "owner": "knowledge",
      "semantics": "知识检索资源不可变配置版本；编辑创建新版本",
      "classification": "immutable_snapshot",
      "source_contract": "配置修订通过摘要固定本地来源、数据成员与索引；新版本不需要 ONES 来源绑定，历史版本须重新保存验证发布，不改写旧证据",
      "canonical_source": "显式知识资源管理操作及固定来源和索引版本",
      "writers": [
        "code:backend/app/modules/knowledge/infrastructure/governance_repository.py"
      ],
      "readers": [
        "code:backend/app/modules/knowledge/infrastructure/governance_repository.py"
      ],
      "lifecycle": "新增默认未核验或未发布；替换保留历史；撤销禁止运行读取",
      "retention_policy": "不自动删除；清理须显式授权并核对发布和审计依赖",
      "audit_requirement": "只记录标识、版本、计数和安全摘要；不保存凭据、正文或原始响应",
      "retirement": {
        "status": "retained",
        "earliest_phase": "never",
        "gates": [
          "替代治理及历史引用留存须先明确确认"
        ]
      },
      "evidence_refs": [
        "migration:137_expand_knowledge_retrieval_governance"
      ]
    },
    {
      "id": "knowledge.retrieval_verification",
      "object_type": "table",
      "table": "knowledge.retrieval_verification",
      "owner": "knowledge",
      "semantics": "知识检索配置技术验证事实；不代替发布和业务授权",
      "classification": "immutable_snapshot",
      "source_contract": "每次验证追加结果，绑定明确配置修订及摘要；旧结果不能用于变更后的配置",
      "canonical_source": "显式知识资源管理操作及固定来源和索引版本",
      "writers": [
        "code:backend/app/modules/knowledge/infrastructure/governance_repository.py"
      ],
      "readers": [
        "code:backend/app/modules/knowledge/infrastructure/governance_repository.py"
      ],
      "lifecycle": "新增默认未核验或未发布；替换保留历史；撤销禁止运行读取",
      "retention_policy": "不自动删除；清理须显式授权并核对发布和审计依赖",
      "audit_requirement": "只记录标识、版本、计数和安全摘要；不保存凭据、正文或原始响应",
      "retirement": {
        "status": "retained",
        "earliest_phase": "never",
        "gates": [
          "替代治理及历史引用留存须先明确确认"
        ]
      },
      "evidence_refs": [
        "migration:137_expand_knowledge_retrieval_governance"
      ]
    },
    {
      "id": "mcp_schema_pagination_cursor",
      "object_type": "table",
      "table": "mcp_schema_pagination_cursor",
      "owner": "mcp_tool_runtime",
      "semantics": "Schema 分页短引用到原始有界游标的临时映射，不是授权凭据",
      "classification": "operational_coordination_fact",
      "canonical_source": "已授权 Schema 查询签发的上下文及资源绑定游标",
      "writers": ["code:backend/app/modules/mcp_tool_runtime/schema_cursor_store.py"],
      "readers": ["code:backend/app/modules/mcp_tool_runtime/schema_cursor_store.py"],
      "lifecycle": "仅 RUNNING Job 签发和使用；跨实例持久化；不修改旧引用",
      "retention_policy": "24 小时到期；tool-mcp 每分钟最多清理 500 项；Job 删除级联清理",
      "audit_requirement": "仅短引用和稳定错误码，不保存认证材料或业务记录正文",
      "retirement": {
        "status": "retained",
        "earliest_phase": "never",
        "gates": ["停止签发并耗尽运行中分页状态后方可退役"]
      },
      "evidence_refs": [
        "migration:135_expand_schema_pagination_cursors",
        "builtin-tool-resource:Schema 分页必须区分下一张表和字段截断"
      ]
    },
    {
      "id": "knowledge.vector_index",
      "object_type": "table",
      "table": "knowledge.vector_index",
      "owner": "knowledge",
      "semantics": "固定语料与模型配置的本机索引版本；不是业务授权",
      "classification": "operational_coordination_fact",
      "canonical_source": "knowledge.document_chunk and versioned local embedding profile",
      "writers": [
        "code:backend/app/modules/knowledge/infrastructure/vector_repository.py"
      ],
      "readers": [
        "code:backend/app/modules/knowledge/infrastructure/vector_repository.py"
      ],
      "lifecycle": "显式索引版本；BUILDING 完整核验后 READY，中断可恢复，版本变化不覆盖",
      "retention_policy": "不自动删除；清理须明确授权并核对依赖",
      "audit_requirement": "仅计数、标识、摘要、固定错误码；不得输出正文或向量",
      "retirement": {
        "status": "retained",
        "earliest_phase": "never",
        "gates": [
          "须显式确认替代索引与数据保留"
        ]
      },
      "evidence_refs": [
        "migration:134_expand_knowledge_vector_indexes",
        "platform-operations:本机知识向量索引必须绑定固定语料和模型版本"
      ]
    },
    {
      "id": "knowledge.vector_index_item",
      "object_type": "table",
      "table": "knowledge.vector_index_item",
      "owner": "knowledge",
      "semantics": "逐块稳定点身份与写入检查点；不是来源事实",
      "classification": "operational_coordination_fact",
      "canonical_source": "knowledge.document_chunk and versioned local embedding profile",
      "writers": [
        "code:backend/app/modules/knowledge/infrastructure/vector_repository.py"
      ],
      "readers": [
        "code:backend/app/modules/knowledge/infrastructure/vector_repository.py"
      ],
      "lifecycle": "显式索引版本；BUILDING 完整核验后 READY，中断可恢复，版本变化不覆盖",
      "retention_policy": "不自动删除；清理须明确授权并核对依赖",
      "audit_requirement": "仅计数、标识、摘要、固定错误码；不得输出正文或向量",
      "retirement": {
        "status": "retained",
        "earliest_phase": "never",
        "gates": [
          "须显式确认替代索引与数据保留"
        ]
      },
      "evidence_refs": [
        "migration:134_expand_knowledge_vector_indexes",
        "platform-operations:本机知识向量索引必须绑定固定语料和模型版本"
      ]
    },
    {
      "id": "knowledge.document_chunk_set",
      "object_type": "table",
      "table": "knowledge.document_chunk_set",
      "owner": "knowledge",
      "semantics": "来源版本与分块配置对应的完整派生集合；不覆盖原版本",
      "classification": "derived_projection",
      "canonical_source": "knowledge.document_revision and versioned chunk profile",
      "writers": [
        "code:backend/app/modules/knowledge/infrastructure/chunk_repository.py"
      ],
      "readers": [
        "code:backend/app/modules/knowledge/infrastructure/chunk_repository.py",
        "code:backend/app/modules/knowledge/infrastructure/vector_repository.py"
      ],
      "lifecycle": "来源版本与配置共同确定；完整集合按事务首次提交，不覆盖历史结果",
      "retention_policy": "跟随来源版本的受控保留；不随 Agent Job 自动删除",
      "audit_requirement": "只记录计数、哈希、机器错误码；不输出真实正文或凭据",
      "retirement": {
        "status": "retained",
        "earliest_phase": "never",
        "gates": [
          "删除或重建须先核对来源及后续索引依赖"
        ]
      },
      "evidence_refs": [
        "migration:133_expand_knowledge_chunks",
        "platform-operations:知识清洗分块必须作为来源版本的可追溯派生结果"
      ]
    },
    {
      "id": "knowledge.document_chunk",
      "object_type": "table",
      "table": "knowledge.document_chunk",
      "owner": "knowledge",
      "semantics": "可定位的事实片段及待向量化文本；不代表已索引或已授权",
      "classification": "derived_projection",
      "canonical_source": "knowledge.document_revision and versioned chunk profile",
      "writers": [
        "code:backend/app/modules/knowledge/infrastructure/chunk_repository.py"
      ],
      "readers": [
        "code:backend/app/modules/knowledge/infrastructure/chunk_repository.py",